scene,japanese,english,hint,level,pronunciation_difficulty,grammar_tags
directions,次の駅で降ります。,Get off at the next station.,交通,beginner,normal,imperative
directions,何番出口ですか？,Which exit should I take?,出口,intermediate,normal,should
directions,反対方向ですか？,Is it the opposite direction?,確認,intermediate,normal,question
directions,道に迷いました。,I am lost.,困った時,beginner,easy,present-simple
directions,助けてもらえますか？,Can you help me?,依頼,beginner,easy,can
directions,もう一度言ってください。,Could you say that again?,聞き返し,beginner,normal,could
directions,ゆっくり話してください。,Please speak slowly.,依頼,beginner,easy,imperative
directions,バス停はどこですか？,Where is the bus stop?,場所,beginner,easy,question
directions,このバスは駅に行きますか？,Does this bus go to the station?,確認,beginner,normal,question
directions,タクシーで行くべきですか？,Should I take a taxi?,提案,intermediate,normal,should
directions,近道はありますか？,Is there a shortcut?,道案内,intermediate,normal,there-is
directions,この道で合っていますか？,Am I on the right road?,確認,intermediate,normal,question
directions,入口はどこですか？,Where is the entrance?,場所,beginner,easy,question
directions,出口はどこですか？,Where is the exit?,場所,beginner,easy,question
directions,エレベーターはどこですか？,Where is the elevator?,場所,beginner,easy,question
directions,階段はどこですか？,Where are the stairs?,場所,beginner,easy,question
directions,この近くにトイレはありますか？,Is there a restroom nearby?,場所,beginner,normal,there-is
directions,案内所はどこですか？,Where is the information desk?,場所,beginner,normal,question
smalltalk,今日はいい天気ですね。,It is nice weather today.,天気,beginner,easy,weather
smalltalk,今日は暑いですね。,It is hot today.,天気,beginner,easy,weather
smalltalk,今日は寒いですね。,It is cold today.,天気,beginner,easy,weather
smalltalk,週末はどうでしたか？,How was your weekend?,雑談,beginner,normal,past-simple|question
smalltalk,週末は楽しかったです。,My weekend was fun.,返答,beginner,normal,past-simple
smalltalk,何をするのが好きですか？,What do you like to do?,趣味,beginner,normal,question
smalltalk,映画を見るのが好きです。,I like watching movies.,趣味,beginner,normal,gerund
smalltalk,音楽は好きですか？,Do you like music?,趣味,beginner,easy,question
smalltalk,どんな音楽を聴きますか？,What kind of music do you listen to?,趣味,intermediate,normal,question
smalltalk,最近忙しいですか？,Have you been busy lately?,近況,intermediate,normal,present-perfect
smalltalk,最近とても忙しいです。,I have been very busy lately.,返答,intermediate,normal,present-perfect
smalltalk,仕事はどうですか？,How is work?,近況,beginner,easy,question
smalltalk,仕事は順調です。,Work is going well.,返答,beginner,normal,present-continuous
smalltalk,この辺りに詳しいですか？,Do you know this area well?,場所,beginner,normal,question
smalltalk,ここは初めてです。,This is my first time here.,会話,beginner,normal,set-phrase
smalltalk,よくここに来ますか？,Do you come here often?,頻度,beginner,normal,adverb-frequency
smalltalk,おすすめの場所はありますか？,Do you have any places to recommend?,おすすめ,intermediate,normal,question
smalltalk,食べ物は何が好きですか？,What food do you like?,好み,beginner,easy,question
smalltalk,辛い食べ物が好きです。,I like spicy food.,好み,beginner,easy,like
smalltalk,日本に来たことはありますか？,Have you been to Japan?,経験,intermediate,normal,present-perfect
smalltalk,いつ日本に来ましたか？,When did you come to Japan?,過去,beginner,normal,past-simple|question
smalltalk,どのくらい滞在しますか？,How long will you stay?,予定,beginner,normal,future
smalltalk,写真を撮るのが好きです。,I like taking photos.,趣味,beginner,normal,gerund
smalltalk,スポーツはしますか？,Do you play sports?,趣味,beginner,easy,question
smalltalk,時々テニスをします。,I sometimes play tennis.,頻度,beginner,easy,adverb-frequency
smalltalk,このイベントは楽しいですね。,This event is fun.,感想,beginner,easy,present-simple
smalltalk,いいお店ですね。,This is a nice place.,感想,beginner,easy,present-simple
smalltalk,また話せてよかったです。,It was nice talking with you.,別れ際,intermediate,normal,gerund
smalltalk,連絡先を交換できますか？,Can we exchange contact information?,依頼,intermediate,normal,can
smalltalk,また会えるといいですね。,I hope we can meet again.,別れ際,intermediate,normal,hope|can
